<?xml version="1.0" encoding="UTF-8"?>
<tns:DCSpec xmlns:tns="http://core.rivalry.org/datacollector"
    xmlns:xsi="http://www.w3.org/2001/XMLSchema-instance"
    xsi:schemaLocation="http://core.rivalry.org/datacollector http://rivalry.googlecode.com/svn/trunk/core/src/main/resources/DataCollector.xsd">
    <url>http://www.bestplaces.net/city/$1</url>
    <selector>
        <type>CLICK</type>
        <value></value>
        <selector>
            <type>XPATH</type>
            <value>//a[text()='Climate']</value>
        </selector>
    </selector>
    <selector>
        <type>ID</type>
        <value>mainContent_dgClimate</value>
        <selector>
            <type>XPATH</type>
            <value>//td/a|//td/font/a</value>
        </selector>
        <selector>
            <type>XPATH</type>
            <value>(//td/a|//td/font/a)/ancestor::td/following-sibling::td[1]</value>
        </selector>
        <selector>
            <type>LITERAL</type>
            <value>Climate</value>
        </selector>
    </selector>

    <selector>
        <type>CLICK</type>
        <value></value>
        <selector>
            <type>XPATH</type>
            <value>//a[text()='Cost of Living']</value>
        </selector>
    </selector>
    <selector>
        <type>ID</type>
        <value>mainContent_dgCostOfLiving</value>
        <selector>
            <type>XPATH</type>
            <value>//td/a</value>
        </selector>
        <selector>
            <type>XPATH</type>
            <value>//td[a]/following-sibling::td[1]</value>
        </selector>
        <selector>
            <type>LITERAL</type>
            <value>Cost of Living</value>
        </selector>
    </selector>

    <selector>
        <type>CLICK</type>
        <value></value>
        <selector>
            <type>XPATH</type>
            <value>//a[text()='Crime']</value>
        </selector>
    </selector>
    <selector>
        <type>ID</type>
        <value>mainContent_dgCrime</value>
        <selector>
            <type>XPATH</type>
            <value>//td/a</value>
        </selector>
        <selector>
            <type>XPATH</type>
            <value>//td[a]/following-sibling::td[1]</value>
        </selector>
        <selector>
            <type>LITERAL</type>
            <value>Crime</value>
        </selector>
    </selector>

    <selector>
        <type>CLICK</type>
        <value></value>
        <selector>
            <type>XPATH</type>
            <value>//a[text()='Economy']</value>
        </selector>
    </selector>
    <selector>
        <type>ID</type>
        <value>mainContent_dgEconomy</value>
        <selector>
            <type>XPATH</type>
            <value>//td/a</value>
        </selector>
        <selector>
            <type>XPATH</type>
            <value>//td[a]/following-sibling::td[1]</value>
        </selector>
        <selector>
            <type>LITERAL</type>
            <value>Economy</value>
        </selector>
    </selector>

    <selector>
        <type>CLICK</type>
        <value></value>
        <selector>
            <type>XPATH</type>
            <value>//a[text()='Education']</value>
        </selector>
    </selector>
    <selector>
        <type>ID</type>
        <value>mainContent_dgEducation</value>
        <selector>
            <type>XPATH</type>
            <value>//td/a</value>
        </selector>
        <selector>
            <type>XPATH</type>
            <value>//td[a]/following-sibling::td[1]</value>
        </selector>
        <selector>
            <type>LITERAL</type>
            <value>Education</value>
        </selector>
    </selector>

    <selector>
        <type>CLICK</type>
        <value></value>
        <selector>
            <type>XPATH</type>
            <value>//a[text()='Health']</value>
        </selector>
    </selector>
    <selector>
        <type>ID</type>
        <value>mainContent_dgHealth</value>
        <selector>
            <type>XPATH</type>
            <value>//td/a</value>
        </selector>
        <selector>
            <type>XPATH</type>
            <value>//td[a]/following-sibling::td[1]</value>
        </selector>
        <selector>
            <type>LITERAL</type>
            <value>Health</value>
        </selector>
    </selector>

    <selector>
        <type>CLICK</type>
        <value></value>
        <selector>
            <type>XPATH</type>
            <value>//a[text()='Housing']</value>
        </selector>
    </selector>
    <selector>
        <type>ID</type>
        <value>mainContent_dgHousing</value>
        <selector>
            <type>XPATH</type>
            <value>//td/a</value>
        </selector>
        <selector>
            <type>XPATH</type>
            <value>//td[a]/following-sibling::td[1]</value>
        </selector>
        <selector>
            <type>LITERAL</type>
            <value>Housing</value>
        </selector>
    </selector>

    <selector>
        <type>CLICK</type>
        <value></value>
        <selector>
            <type>XPATH</type>
            <value>//a[text()='People']</value>
        </selector>
    </selector>
    <selector>
        <type>ID</type>
        <value>mainContent_dgPeople</value>
        <selector>
            <type>XPATH</type>
            <value>//td/a</value>
        </selector>
        <selector>
            <type>XPATH</type>
            <value>//td[a]/following-sibling::td[1]</value>
        </selector>
        <selector>
            <type>LITERAL</type>
            <value>People</value>
        </selector>
    </selector>

    <selector>
        <type>CLICK</type>
        <value></value>
        <selector>
            <type>XPATH</type>
            <value>//a[text()='Religion']</value>
        </selector>
    </selector>
    <selector>
        <type>ID</type>
        <value>mainContent_dgReligion</value>
        <selector>
            <type>XPATH</type>
            <value>//td/a</value>
        </selector>
        <selector>
            <type>XPATH</type>
            <value>//td[a]/following-sibling::td[1]</value>
        </selector>
        <selector>
            <type>LITERAL</type>
            <value>Religion</value>
        </selector>
    </selector>

    <selector>
        <type>CLICK</type>
        <value></value>
        <selector>
            <type>XPATH</type>
            <value>//a[text()='Transportation']</value>
        </selector>
    </selector>
    <selector>
        <type>ID</type>
        <value>mainContent_dgTransportation</value>
        <selector>
            <type>XPATH</type>
            <value>//td/a</value>
        </selector>
        <selector>
            <type>XPATH</type>
            <value>//td[a]/following-sibling::td[1]</value>
        </selector>
        <selector>
            <type>LITERAL</type>
            <value>Transportation</value>
        </selector>
    </selector>

    <selector>
        <type>CLICK</type>
        <value></value>
        <selector>
            <type>XPATH</type>
            <value>//a[text()='Voting']</value>
        </selector>
    </selector>
    <selector>
        <type>ID</type>
        <value>mainContent_dgVoting</value>
        <selector>
            <type>XPATH</type>
            <value>//td/a</value>
        </selector>
        <selector>
            <type>XPATH</type>
            <value>//td[a]/following-sibling::td[1]</value>
        </selector>
        <selector>
            <type>LITERAL</type>
            <value>Voting</value>
        </selector>
    </selector>
</tns:DCSpec>
 