<?xml version="1.0" encoding="UTF-8"?>
<tns:DCSpec xmlns:tns="http://core.rivalry.org/datacollector"
    xmlns:xsi="http://www.w3.org/2001/XMLSchema-instance"
    xsi:schemaLocation="http://core.rivalry.org/datacollector http://rivalry.googlecode.com/svn/trunk/core/src/main/resources/DataCollector.xsd">
    <url>http://seeker.dice.com/jobsearch/servlet/JobSearch?op=300&amp;QUICK=1&amp;FREE_TEXT=$1&amp;Ntx=mode+matchall</url>
    <selector>
        <type>ID</type>
        <value>searchResHD</value>
        <selector>
            <type>LITERAL</type>
            <value>Count</value>
        </selector>
        <selector>
            <type>TAG_NAME</type>
            <value>h2</value>
        </selector>
    </selector>
</tns:DCSpec>
