<?xml version="1.0" encoding="UTF-8"?>
<tns:DCSpec xmlns:tns="http://core.rivalry.org/datacollector"
    xmlns:xsi="http://www.w3.org/2001/XMLSchema-instance"
    xsi:schemaLocation="http://core.rivalry.org/datacollector http://rivalry.googlecode.com/svn/trunk/core/src/main/resources/DataCollector.xsd">
    <url>http://dogtime.com/dog-breeds/$1</url>
    <selector>
        <type>CLASS_NAME</type>
        <value>geekitem_infotable</value>
        <selector>
            <type>XPATH</type>
            <value>//td[@width=150]</value>
        </selector>
        <selector>
            <type>XPATH</type>
            <value>//td[@width=150]/following-sibling::td[1]</value>
        </selector>
    </selector>
</tns:DCSpec>
