<?xml version="1.0" encoding="UTF-8"?>
<tns:DCSpec xmlns:tns="http://core.rivalry.org/datacollector"
    xmlns:xsi="http://www.w3.org/2001/XMLSchema-instance"
    xsi:schemaLocation="http://core.rivalry.org/datacollector file:////Users/jmthompson/Dropbox/SoftwareDev/JavaProjects/rivalry/trunk/core/src/main/resources/DataCollector.xsd"
    >
    <!-- 
    xsi:schemaLocation="http://core.rivalry.org/datacollector file:///../../../../../../../main/resources/DataCollector.xsd"
     -->
    <url>http://finance.yahoo.com/q/ks?s=$1+Key+Statistics</url>
    <selector>
        <type>CLASS_NAME</type>
        <value>yfnc_datamodoutline1</value>
        <selector>
            <type>CLASS_NAME</type>
            <value>yfnc_tablehead1</value>
        </selector>
        <selector>
            <type>CLASS_NAME</type>
            <value>yfnc_tabledata1</value>
        </selector>
    </selector>
</tns:DCSpec>
